{
  "$schema": "https://json-schema.org/draft/2020-12/schema",
  "title": "ArticleLayout",
  "description": "一份排版参数的契约。文章线站 4 生成风格候选时产出它，校验器 check_layout.py 判它。**参数是判据的真源，HTML 是参数的可视化**——所以先定参数、再过校验、最后渲染 HTML。图片线的封面文字层之后复用同一份契约。",
  "type": "object",
  "required": [
    "schema_version",
    "font_size_body_px",
    "line_height",
    "letter_spacing_em",
    "heading_sizes_px",
    "measure_chars",
    "first_line_indent_em",
    "paragraph_spacing_em",
    "cjk_latin_spacing_em",
    "line_break_level",
    "colors"
  ],
  "properties": {
    "schema_version": {
      "enum": ["article-layout/v1"],
      "description": "契约版本。改了字段就改版本，别让旧参数按新规则被判。"
    },
    "font_size_body_px": {
      "type": "number",
      "description": "正文字号。判据 TY-08，硬下限 14px。"
    },
    "line_height": {
      "type": "object",
      "required": ["body", "heading"],
      "properties": {
        "body": {"type": "number", "description": "正文行距倍数。判据 TY-02，目标 1.6–1.8。"},
        "heading": {"type": "number", "description": "标题行距倍数。判据 TY-03，目标 1.1–1.4。"}
      }
    },
    "letter_spacing_em": {
      "type": "object",
      "required": ["body", "heading"],
      "properties": {
        "body": {"type": "number", "description": "正文字距 em。判据 TY-04，目标 0–0.05。"},
        "heading": {"type": "number", "description": "标题字距 em。判据 TY-05，目标 0.05–0.15。"}
      }
    },
    "heading_sizes_px": {
      "type": "array",
      "minItems": 1,
      "description": "各级标题字号，从 h1 往下。判据 TY-07：必须严格递减。",
      "items": {"type": "number"}
    },
    "measure_chars": {
      "type": "number",
      "description": "每行汉字数。判据 TY-01，目标 25–35，硬上限 40。"
    },
    "max_width_px": {
      "type": "number",
      "description": "正文区最大宽度。判据 TY-13，目标 650–750。**不填就是不做**——宽屏铺满是最高频的排版错误。"
    },
    "first_line_indent_em": {
      "type": "number",
      "description": "首行缩进 em。判据 TY-06：与 paragraph_spacing_em 不可同时大于 0。"
    },
    "paragraph_spacing_em": {
      "type": "number",
      "description": "段间距 em。判据 TY-06：与 first_line_indent_em 不可同时大于 0。"
    },
    "cjk_latin_spacing_em": {
      "type": "number",
      "description": "中西文之间的间距 em。判据 TY-12，上限 0.25（clreq §2.1.3）。"
    },
    "line_break_level": {
      "enum": ["none", "basic", "gb", "strict"],
      "description": "避头尾级别，clreq 四级。判据 TY-11。**必须显式声明**——不声明等于不做。"
    },
    "colors": {
      "type": "object",
      "required": ["text", "background"],
      "description": "配色。校验器用 text / background 算对比度，判据 TY-09。",
      "properties": {
        "text": {"type": "string", "description": "正文文字色，十六进制如 #1a1a1a。"},
        "background": {"type": "string", "description": "背景色，十六进制。"},
        "heading": {"type": "string", "description": "标题文字色。填了就走 TY-10（大字 3:1），不填按正文色判。"}
      }
    },
    "human_review": {
      "description": "机器判不了的那一半。沿用图片线 appeal_review 的做法：人判、登记。**不登记就等于没做。**",
      "type": "object",
      "required": ["reviewed_by", "reviewed_at", "verdicts"],
      "properties": {
        "reviewed_by": {"type": "string"},
        "reviewed_at": {"type": "string"},
        "verdicts": {
          "type": "object",
          "required": ["reads_comfortably", "hierarchy_is_clear", "style_matches_content"],
          "properties": {
            "reads_comfortably": {"enum": ["pass", "fail", "unknown"]},
            "hierarchy_is_clear": {"enum": ["pass", "fail", "unknown"]},
            "style_matches_content": {"enum": ["pass", "fail", "unknown"]}
          }
        }
      }
    }
  }
}
